{
  "$schema": "http://json-schema.org/draft-07/schema#",
  "$id": "https://clawrocket.dev/contracts/editorial-room/v0/markdown_source_map.schema.json",
  "title": "MarkdownSourceMap",
  "description": "Anchor primitive for suggestions. Generated alongside the Markdown snapshot for a draft revision; lets Skill-returned suggestions resolve to ProseMirror positions deterministically. See EDITORIAL_ROOM_CONTRACT.md §5.1. §7 cap: 1 MB per revision.",
  "type": "object",
  "additionalProperties": false,
  "definitions": {
    "PmRange": {
      "type": "object",
      "additionalProperties": false,
      "required": ["from", "to"],
      "properties": {
        "from": { "type": "integer", "minimum": 0 },
        "to": { "type": "integer", "minimum": 0 }
      }
    },
    "MarkdownRange": {
      "type": "object",
      "additionalProperties": false,
      "required": ["start", "end"],
      "properties": {
        "start": { "type": "integer", "minimum": 0 },
        "end": { "type": "integer", "minimum": 0 }
      }
    },
    "SourceMapSpan": {
      "type": "object",
      "additionalProperties": false,
      "required": [
        "span_id",
        "pm_range",
        "markdown_range",
        "normalized_text",
        "text_hash"
      ],
      "properties": {
        "span_id": { "type": "string", "minLength": 1 },
        "pm_range": { "$ref": "#/definitions/PmRange" },
        "markdown_range": { "$ref": "#/definitions/MarkdownRange" },
        "normalized_text": { "type": "string" },
        "text_hash": { "type": "string", "minLength": 1 }
      }
    },
    "SourceMapBlock": {
      "type": "object",
      "additionalProperties": false,
      "required": [
        "block_id",
        "node_path",
        "pm_range",
        "markdown_range",
        "normalized_text",
        "text_hash",
        "context_before",
        "context_after"
      ],
      "properties": {
        "block_id": {
          "type": "string",
          "minLength": 1,
          "description": "Stable across save-cycles."
        },
        "node_path": {
          "type": "array",
          "items": { "type": "integer", "minimum": 0 },
          "description": "ProseMirror node path."
        },
        "pm_range": { "$ref": "#/definitions/PmRange" },
        "markdown_range": { "$ref": "#/definitions/MarkdownRange" },
        "normalized_text": { "type": "string" },
        "text_hash": { "type": "string", "minLength": 1 },
        "context_before": {
          "type": "string",
          "maxLength": 80,
          "description": "≤80 chars."
        },
        "context_after": {
          "type": "string",
          "maxLength": 80,
          "description": "≤80 chars."
        },
        "spans": {
          "type": "array",
          "items": { "$ref": "#/definitions/SourceMapSpan" },
          "description": "Optional initially per §5.1; required when inline-mark suggestion targeting ships."
        }
      }
    }
  },
  "required": ["schema_version", "revision_id", "content_hash", "blocks"],
  "properties": {
    "schema_version": { "const": "0" },
    "revision_id": {
      "type": "string",
      "minLength": 1,
      "description": "ULID of the revision this map was generated for."
    },
    "content_hash": {
      "type": "string",
      "minLength": 1,
      "description": "Hash of the revision's content_md_snapshot."
    },
    "blocks": {
      "type": "array",
      "items": { "$ref": "#/definitions/SourceMapBlock" },
      "description": "Block-level coverage required per §5.1 for paragraph, heading, bullet_list, ordered_list, code_block, blockquote, hard_break."
    }
  }
}
