{
  "schema_version": "0",
  "revision_id": "01HXYZREV001AAAAAAAAAAAAAA",
  "content_hash": "sha256:rev001aaa00000000000000000000000000000000000000000000000000000000",
  "blocks": [
    {
      "block_id": "blk_0001",
      "node_path": [0],
      "pm_range": { "from": 0, "to": 268 },
      "markdown_range": { "start": 0, "end": 266 },
      "normalized_text": "When Embracer wrote down $2.1B last quarter, the surviving indie studios noticed a different number first: the MG. Recoupment terms that would have been 'competitive' in 2022 are now the ceiling, not the floor. The writedown itself isn't structural; the reclassification is.",
      "text_hash": "sha256:b0001hash00000000000000000000000000000000000000000000000000000000",
      "context_before": "",
      "context_after": "\n\n"
    },
    {
      "block_id": "blk_0002",
      "node_path": [1],
      "pm_range": { "from": 270, "to": 502 },
      "markdown_range": { "start": 268, "end": 498 },
      "normalized_text": "For the studios that signed in 2024-2025, this isn't news. They lived through the conversion. But for anyone entering negotiations now, the deal shape has hardened in ways that weren't visible when Embracer announced.",
      "text_hash": "sha256:b0002hash00000000000000000000000000000000000000000000000000000000",
      "context_before": "ation is.\n\n",
      "context_after": "\n\n"
    },
    {
      "block_id": "blk_0003",
      "node_path": [2],
      "pm_range": { "from": 504, "to": 740 },
      "markdown_range": { "start": 500, "end": 734 },
      "normalized_text": "The structural change has three components, and they compound. First, MG itself has been reclassified as a conditional liability under post-Embracer accounting. Second, recoupment terms have hardened.",
      "text_hash": "sha256:b0003hash00000000000000000000000000000000000000000000000000000000",
      "context_before": "nounced.\n\n",
      "context_after": "\n\n"
    },
    {
      "block_id": "blk_0004",
      "node_path": [3],
      "pm_range": { "from": 742, "to": 880 },
      "markdown_range": { "start": 736, "end": 872 },
      "normalized_text": "Third — and this is the piece most studios miss — conditional advances default to lower thresholds when the publisher claims structural risk.",
      "text_hash": "sha256:b0004hash00000000000000000000000000000000000000000000000000000000",
      "context_before": "ardened.\n\n",
      "context_after": "\n\n"
    },
    {
      "block_id": "blk_0005",
      "node_path": [4],
      "pm_range": { "from": 882, "to": 1010 },
      "markdown_range": { "start": 874, "end": 1000 },
      "normalized_text": "If you're signing in the next 18 months, assume the floor is now the ceiling. Negotiate against that, not against the 2022 numbers.",
      "text_hash": "sha256:b0005hash00000000000000000000000000000000000000000000000000000000",
      "context_before": "claims.\n\n",
      "context_after": ""
    }
  ]
}
