{
  "schema_version": "0",
  "revision_id": "01HXYZREV002BBBBBBBBBBBBBB",
  "content_hash": "sha256:rev002bbb00000000000000000000000000000000000000000000000000000000",
  "blocks": [
    {
      "block_id": "blk_h_0001",
      "node_path": [0],
      "pm_range": { "from": 0, "to": 28 },
      "markdown_range": { "start": 0, "end": 28 },
      "normalized_text": "Three structural changes",
      "text_hash": "sha256:bh0001hash0000000000000000000000000000000000000000000000000000000",
      "context_before": "",
      "context_after": "\n\n"
    },
    {
      "block_id": "blk_p_0001",
      "node_path": [1],
      "pm_range": { "from": 30, "to": 100 },
      "markdown_range": { "start": 30, "end": 100 },
      "normalized_text": "The accounting reclassification has three components, and they compound:",
      "text_hash": "sha256:bp0001hash0000000000000000000000000000000000000000000000000000000",
      "context_before": "changes\n\n",
      "context_after": "\n\n"
    },
    {
      "block_id": "blk_ol_0001",
      "node_path": [2],
      "pm_range": { "from": 102, "to": 268 },
      "markdown_range": { "start": 102, "end": 268 },
      "normalized_text": "1. MG reclassified as conditional liability\n2. Recoupment terms hardened to 1.4× from 1.0×\n3. Conditional advances default to lower thresholds when structural risk is claimed",
      "text_hash": "sha256:bo0001hash0000000000000000000000000000000000000000000000000000000",
      "context_before": "ompound:\n\n",
      "context_after": "\n\n"
    },
    {
      "block_id": "blk_p_0002",
      "node_path": [3],
      "pm_range": { "from": 270, "to": 332 },
      "markdown_range": { "start": 270, "end": 332 },
      "normalized_text": "Inside an indie deal table, the differences read like this:",
      "text_hash": "sha256:bp0002hash0000000000000000000000000000000000000000000000000000000",
      "context_before": "claimed\n\n",
      "context_after": "\n\n"
    },
    {
      "block_id": "blk_table_0001",
      "node_path": [4],
      "pm_range": { "from": 334, "to": 558 },
      "markdown_range": { "start": 334, "end": 552 },
      "normalized_text": "| Term | 2022 | Post-Embracer | Direction |\n|---|---|---|---|\n| MG ($K) | 200 | 150 | down |\n| Recoupment | 1.0× | 1.4× | up |\n| Conditional floor | 0.6× | 0.4× | down |",
      "text_hash": "sha256:bt0001hash0000000000000000000000000000000000000000000000000000000",
      "context_before": "ke this:\n\n",
      "context_after": "\n\n"
    },
    {
      "block_id": "blk_ul_0001",
      "node_path": [5],
      "pm_range": { "from": 560, "to": 712 },
      "markdown_range": { "start": 554, "end": 706 },
      "normalized_text": "- The MG drop is direct.\n- The recoupment shift is masked by 'standard practice' language.\n- The conditional-floor change is the one publishers won't volunteer.",
      "text_hash": "sha256:bu0001hash0000000000000000000000000000000000000000000000000000000",
      "context_before": " | down |\n\n",
      "context_after": ""
    }
  ]
}
